{
  "id": "montitrentini",
  "subdomain": "montitrentini",
  "brand": {
    "name": "Monti Trentini",
    "logo": "",
    "colors": {
      "primary": "#064E22",
      "accent": "#009640"
    },
    "fonts": {
      "heading": "Fraunces",
      "body": "Inter"
    },
    "radius": "md"
  },
  "cloudinaryFolder": "monti-trentini",
  "cloudinaryLegacyFolders": ["monti"],
  "crm": "hubspot",
  "calendar": {
    "provider": "google",
    "address": "Sales@montitrentini-Usa.com",
    "defaultDurationMinutes": 45
  },
  "deals": [],
  "modules": [
    "catalog",
    "orders",
    "crm",
    "campaigns"
  ],
  "home": {
    "eyebrow": "Casa Finco, casari dal 1925",
    "title": "Operations Portal",
    "tagline": "One source of truth — catalog, inventory, pricing and commitments — feeding every Monti Trentini tool. Wholesale-first.",
    "footer": "A hundred-year-long story does not happen by chance."
  },
  "presentations": [],
  "contentQuota": 100,
  "tools": [
    {
      "key": "price-list",
      "label": "Pricing & Inventory",
      "description": "Wholesale quoting, movement planning, and commitments — on the canonical data layer.",
      "icon": "calculator",
      "type": "internal",
      "route": "pricing",
      "status": "live",
      "featured": true,
      "tag": "Quoting · priority #1"
    },
    {
      "key": "crm",
      "label": "CRM",
      "description": "Contacts, companies and pipeline — live from HubSpot, read-only.",
      "icon": "contact",
      "type": "internal",
      "route": "crm",
      "status": "live",
      "tag": "CRM · live"
    },
    {
      "key": "booth",
      "label": "Greet to Meet",
      "description": "Turns a greeting into a meeting — a trade-show floor, a networking cocktail hour, or a chance encounter during the day. Capture it and book the next step on the spot. Works offline.",
      "icon": "calendar-check",
      "type": "internal",
      "route": "booth",
      "status": "live",
      "featured": true,
      "tag": "Field · offline-first",
      "allowed": ["admin", "client"]
    },
    {
      "key": "presentation-library",
      "label": "Presentation Library",
      "description": "Personalized presentations built by the rep or sales support for a specific buyer. For now this opens the shared Content Library; individual, email-gated access for each rep/presentation is planned next.",
      "icon": "presentation",
      "type": "internal",
      "route": "presentations",
      "status": "live",
      "tag": "Sales decks"
    },
    {
      "key": "campaigns",
      "label": "Campaigns",
      "description": "Email, social and enrichment campaigns — launch readiness, audience and results.",
      "icon": "megaphone",
      "type": "internal",
      "route": "campaigns",
      "status": "live",
      "tag": "Campaign lifecycle",
      "allowed": ["admin"]
    },
    {
      "key": "buyer-catalog",
      "label": "Product catalog",
      "description": "Buyer-facing product image library — search, preview, download, share.",
      "icon": "images",
      "type": "internal",
      "route": "catalog",
      "status": "live",
      "tag": "Catalog",
      "featured": true
    },
    {
      "key": "shopify",
      "label": "Storefront",
      "description": "Monti Trentini's online store — browse the live shop or open it full-screen.",
      "icon": "store",
      "type": "external",
      "url": "https://mt-e-comm.netlify.app/ui_kits/shopify-store/",
      "status": "live",
      "featured": true,
      "embed": true,
      "admin": true,
      "tag": "DTC · live",
      "allowed": ["admin"]
    }
  ]
}
