{
  "$schema": "./client.schema.json",
  "id": "demo",
  "subdomain": "demo",
  "brand": {
    "name": "Alpine Rind Co.",
    "logo": "",
    "colors": {
      "primary": "#9A3B1B",
      "accent": "#5F6B2E"
    },
    "fonts": {
      "heading": "Fraunces",
      "body": "Inter"
    },
    "radius": "md"
  },
  "cloudinaryFolder": "clients/alpine-rind",
  "crm": "sample",
  "modules": [
    "catalog",
    "orders",
    "crm",
    "campaigns"
  ],
  "home": {
    "eyebrow": "Alpine Rind Co. \u00b7 Alpine technique, Vermont pasture \u00b7 Est. 2016",
    "title": "Operations Portal",
    "tagline": "One source of truth \u2014 catalog, inventory, pricing and commitments \u2014 feeding every tool. This is CST's own showroom tenant, built the way a real client's onboarding output looks.",
    "footer": "Alpine Rind Co. \u2014 a CheeseShop TECH showroom brand."
  },
  "presentations": [],
  "tools": [
    {
      "key": "price-list",
      "label": "Pricing & Inventory",
      "description": "Wholesale quoting, movement planning, and commitments \u2014 on the canonical data layer.",
      "icon": "calculator",
      "type": "internal",
      "route": "pricing",
      "status": "live",
      "featured": true,
      "tag": "Quoting"
    },
    {
      "key": "crm",
      "label": "CRM",
      "description": "Contacts, companies and pipeline \u2014 sample data for this showroom tenant.",
      "icon": "contact",
      "type": "internal",
      "route": "crm",
      "status": "live",
      "tag": "CRM"
    },
    {
      "key": "trade-portal",
      "label": "Trade Portal",
      "description": "The buyer presentation \u2014 brand story, range, and trade program.",
      "icon": "presentation",
      "type": "internal",
      "route": "presentations",
      "status": "live",
      "tag": "Sales deck"
    },
    {
      "key": "campaigns",
      "label": "Campaigns",
      "description": "Email, social and enrichment campaigns \u2014 launch readiness, audience and results.",
      "icon": "megaphone",
      "type": "internal",
      "route": "campaigns",
      "status": "live",
      "tag": "Campaigns"
    },
    {
      "key": "buyer-catalog",
      "label": "Product catalog",
      "description": "Buyer-facing product image library \u2014 search, preview, download, share.",
      "icon": "images",
      "type": "internal",
      "route": "catalog",
      "status": "live",
      "tag": "Catalog",
      "featured": true
    },
    {
      "key": "storefront",
      "label": "Storefront",
      "description": "The client's online store \u2014 browse the live shop or open it full-screen.",
      "icon": "store",
      "type": "external",
      "url": "",
      "status": "coming-soon",
      "tag": "DTC"
    }
  ]
}
