{
  "id": "montitrentini",
  "subdomain": "montitrentini",
  "brand": {
    "name": "Monti Trentini",
    "logo": "",
    "colors": { "primary": "#064E22", "accent": "#009640" },
    "fonts": { "heading": "Fraunces", "body": "Inter" },
    "radius": "md"
  },
  "cloudinaryFolder": "monti-trentini",
  "crm": "hubspot",
  "modules": ["catalog", "orders", "crm", "campaigns"],
  "home": {
    "eyebrow": "Casa Finco, casari dal 1925",
    "title": "Operations Portal",
    "tagline": "One source of truth — catalog, inventory, pricing and commitments — feeding every Monti Trentini tool. Wholesale-first.",
    "footer": "A hundred-year-long story does not happen by chance."
  },
  "tools": [
    {
      "key": "price-list",
      "label": "Pricing & Inventory",
      "description": "Wholesale quoting, movement planning, and commitments — on the canonical data layer.",
      "icon": "calculator",
      "type": "internal",
      "route": "pricing",
      "status": "live",
      "featured": true,
      "tag": "Quoting · priority #1"
    },
    {
      "key": "image-catalog",
      "label": "Image catalog",
      "description": "Product & brand media library.",
      "icon": "images",
      "type": "internal",
      "route": "media",
      "status": "live",
      "tag": "Media"
    },
    {
      "key": "shopify",
      "label": "Storefront",
      "description": "Monti Trentini's online store — browse the live shop or open it full-screen.",
      "icon": "store",
      "type": "external",
      "url": "https://mt-e-comm.netlify.app/ui_kits/shopify-store/",
      "status": "live",
      "featured": true,
      "embed": true,
      "admin": true,
      "tag": "DTC · live"
    }
  ]
}
